title,year,rating,votes,metascore,genres,budget,gross,plot outline
Hunter Killer,2018,6.6,20862,43,"['Action', 'Thriller']",40000000.0,29300000.0,"A U.S. submarine, the USS Tampa Bay, vanishes while shadowing a Russian Akula-class submarine in the Arctic. Rear Admiral John Fisk sends a Virginia-class submarine, the USS Arkansas, under the command of newly-promoted and unorthodox Commander Joe Glass to investigate. At the same time, a Navy SEAL team under the command of Lieutenant Bill Beaman is sent in to discreetly observe a Russian naval base. When they arrive at the naval base, they witness defense minister Dmitri Durov conducting a coup d'etat and taking Russian President Zakarin prisoner, and swiftly realize that Durov intends to trigger a war.."
The Vanishing,2018,5.8,3820,66,"['Drama', 'Mystery', 'Thriller']",,,"Formally known as KEEPERS, The Vanishing is Inspired by the Flannan Isle mystery. A small relief boat approaches the Isle, a tiny isolated island no bigger than a football pitch, 20 miles off a rugged coast. Its aim is to routinely replace the three lighthouse keepers, after 6 weeks alone manning the light. It nears the dock and none of the men greet them. The winch is broken. A call. Nothing. Experienced keepers Thomas, James and Donald have vanished. The lamps are clean and refilled; the table is laid for dinner. There is an upturned chair. Two sets of yellow oilskins are missing...The men were never found."
Den of Thieves,2018,7.0,63050,49,"['Action', 'Crime', 'Drama', 'Mystery', 'Thriller']",30000000.0,80500000.0,A gritty L.A crime saga which follows the intersecting and often personally connected lives of an elite unit of the LA County Sheriff's Dept. and the state's most successful bank robbery crew as the outlaws plan a seemingly impossible heist on the Federal Reserve Bank of downtown Los Angeles.
Geostorm,2017,5.3,74392,21,"['Action', 'Sci-Fi', 'Thriller']",120000000.0,221600000.0,"When catastrophic climate change endangers Earth's very survival, world governments unite and create the Dutch Boy Program: a world wide net of satellites, surrounding the planet, that are armed with geoengineering technologies designed to stave off the natural disasters. After successfully protecting the planet for three years, something is starting to go wrong. Two estranged brothers are tasked with solving the program's malfunction before a world wide Geostorm can engulf the planet."
A Family Man,2016,6.5,7958,21,['Drama'],,,"As the boss (Willem Dafoe) of a Chicago-based headhunter prepares to retire, Dane Jensen (Gerard Butler), who works at the Blackridge Recruiting agency arranging jobs for engineers, vies to achieve his longtime goal of taking over the company going head-to-head with his ambitious rival, Lynn Vogel (Alison Brie). However, Dane's 10-year-old son, Ryan (Maxwell Jenkins), is suddenly diagnosed with cancer and his professional priorities at work and personal priorities at home begin to clash with one another."
London Has Fallen,2016,5.9,121591,28,"['Action', 'Thriller']",60000000.0,205800000.0,"After the British Prime Minister has passed away under mysterious circumstances, all leaders of the Western world must attend his funeral. But what starts out as the most protected event on earth, turns into a deadly plot to kill the world's most powerful leaders and unleash a terrifying vision of the future. The President of the United States, his formidable secret service head and a British MI-6 agent who trusts no one are the only people that have any hope of stopping it."
Gods of Egypt,2016,5.4,92451,25,"['Action', 'Adventure', 'Fantasy']",140000000.0,150700000.0,"Set, the merciless god of darkness, has taken over the throne of Egypt and plunged the once peaceful and prosperous empire into chaos and conflict. Few dare to rebel against him. A young thief, whose love was taken captive by the god, seeks to dethrone and defeat Set with the aid of the powerful god Horus."
Olympus Has Fallen,2013,6.5,231851,41,"['Action', 'Thriller']",70000000.0,170300000.0,"When the White House (Secret Service Code: ""Olympus"") is captured by a terrorist mastermind and the President is kidnapped, disgraced former Presidential Secret Service Agent Mike Banning finds himself trapped within the building. As our national security team scrambles to respond, they are forced to rely on Banning's inside knowledge to help retake the White House, save the President and avert an even bigger disaster."
Movie 43,2013,4.3,90892,18,['Comedy'],6000000.0,32400000.0,"Ineffectual, 'has-been' film-maker (Dennis Quaid) swindles his way into an interview with a film executive (Greg Kinnear) in order to pitch an outrageous and controversial comedy manuscript. After pitching the first of his thirteen offbeat fables, the dejected artist forces the rest of his disjointed allegory on the executive at gunpoint. He tells stories of a woman on a blind date with a man who has testicles growing from his neck, in another a smitten woman offers her neck to her boyfriend to 'poop' on -as a sign of commitment and love. In yet another two parents take home-schooling to a whole new level of indecency, striving to give their isolated teenage son all the 'regular' torment and humiliation of puberty by bullying, peer-pressuring and even seducing him themselves. An off-beat, elephant-in-the-room type film."
Playing for Keeps,2012,5.7,27135,27,"['Comedy', 'Romance', 'Sport']",55000000.0,24100000.0,"George is a former professional soccer star who's moved to Virginia to be close to his ex-wife and son. He's broke, jobless, without a plan, and a constant source of disappointment to his son. When he takes over as his son's soccer coach, he has a new connection to the lad. He also gets the attention of three of the players' moms as well as the glad hand of a wealthy dad. His ex-wife's getting married, he has a lead on a sportscasting job, and he finds new ways to disappoint his son. Is there any way he can sort things out?"
Chasing Mavericks,2012,7.2,28676,45,"['Biography', 'Drama', 'Sport']",20000000.0,8300000.000000001,"The inspirational true story of real life surfing phenomenon Jay Moriarity. When 15 year old Jay discovers that the mythic Mavericks surf break, one of the biggest waves on Earth, is not only real, but exists just miles from his Santa Cruz home, he enlists the help of local legend Frosty Hesson to train him to survive it. As Jay and Frosty embark on their quest to accomplish the impossible, they form a unique friendship that transforms both their lives, and their quest to tame Mavericks becomes about far more than surfing."
Dragons: Gift of the Night Fury,2011,7.6,5402,Nan,"['Animation', 'Short', 'Adventure', 'Comedy', 'Family', 'Fantasy']",,,"The Viking town of Berk, now enjoying its new alliance with the dragons, is preparing for its annual winter holiday of Snoggletog. However, that spirit is threatened when all the dragons, except Toothless who needs Hiccup to help him, suddenly fly away for some reason. While Astrid ineffectually tries to salvage the occasion, Hiccup decides to build Toothless a new prosthetic to allow him to fly independently, only to have the dragon take off as well. However, as the holiday approaches, Hiccup finds himself swept up to learn the dragons' secret the hard way and to find a solution to bring them home early."
Machine Gun Preacher,2011,6.8,59435,43,"['Action', 'Biography', 'Crime', 'Drama']",30000000.0,3000000.0,"In Pittsburgh, Pennsylvania, addicted gang biker Sam Childers is released from prison and learns that his wife Lynn is no longer a stripper but has converted to Christianity. One night, Sam and his best friend Donnie give a ride to a hitchhiker who threatens Donnie with a pocketknife; however Sam reacts and turns the tables on the stranger. Sam is affected by the incident and is convinced by Lynn and his mother Daisy to join their church, and he is baptized. Sam finds a straight job in construction. When he meets a preacher from Africa, he decides to visit the continent. Sam travels to Northern Uganda and South Sudan many times and builds an orphanage for the victims of the cruel Lord's Resistance Army (LRA). Further, he fights whenever necessary and becomes a legend known as The Machine Gun Preacher."
Coriolanus,2011,6.1,29350,79,"['Drama', 'Thriller', 'War']",7700000.0,1072602.0,"The citizens of Rome are hungry. Coriolanus, the hero of Rome, a great soldier and a man of inflexible self-belief despises the people. His extreme views ignite a mass riot. Rome is bloody. Manipulated and out-maneuvered by politicians and even his own mother Volumnia, Coriolanus is banished from Rome. He offers his life or his services to his sworn enemy Tullus Aufidius."
Legend of the Boneknapper Dragon,2010,7.1,2499,Nan,"['Animation', 'Short', 'Adventure', 'Comedy', 'Family', 'Fantasy']",,,"When Gobber's house burns down, the old Viking is convinced that his nemesis, the legendary Boneknapper Dragon, is responsible. Bent on revenge, Gobber resolves to hunt it down once and for all, despite the fact that no one believes the dragon exists. Regardless, Hiccup and the gang decide to accompany him for his own good. On the sea voyage, Gobber tells the story of his rivalry with the beast, which gets sillier with each episode. When the gang find themselves shipwrecked on the suspected island of the beast, they are about to learn the truth about the dragon."
Dreamworks How to Train Your Dragon Legends,2010,7.8,869,Nan,"['Animation', 'Adventure', 'Comedy', 'Family', 'Fantasy']",165000000.0,495800000.0,Nan
How to Train Your Dragon,2010,8.1,593517,74,"['Animation', 'Action', 'Adventure', 'Comedy', 'Family', 'Fantasy']",165000000.0,495800000.0,"Long ago up North on the Island of Berk, the young Viking, Hiccup, wants to join his town's fight against the dragons that continually raid their town. However, his macho father and village leader, Stoik the Vast, will not allow his small, clumsy, but inventive son to do so. Regardless, Hiccup ventures out into battle and downs a mysterious Night Fury dragon with his invention, but can't bring himself to kill it. Instead, Hiccup and the dragon, whom he dubs Toothless, begin a friendship that would open up both their worlds as the observant boy learns that his people have misjudged the species. But even as the two each take flight in their own way, they find that they must fight the destructive ignorance plaguing their world."
The Bounty Hunter,2010,5.6,110659,22,"['Action', 'Comedy', 'Romance']",42500000.0,136300000.0,"Milo Boyd, a down-on-his-luck bounty hunter, gets his dream job when he is assigned to track down his bail-jumping ex-wife, reporter Nicole Hurly. He thinks all that's ahead is an easy payday, but when Nicole gives him the slip so she can chase a lead on a murder cover-up, Milo realizes that nothing ever goes simply with him and Nicole. The exes continually one-up each other - until they find themselves on the run for their lives. They thought their promise to love, honor and obey was tough - staying alive is going to be a whole lot tougher."
Law Abiding Citizen,2009,7.4,248518,34,"['Crime', 'Drama', 'Thriller']",53000000.0,126700000.0,"Clyde Shelton's family is brutally murdered. The ones responsible are caught. However, because of improper procedure, the D.A., Nick Rice only has circumstantial evidence. So he decides to get one of them to testify against the other. When Shelton learns of this, he is not happy. Ten years later, the one who was convicted is being executed but something goes wrong; his execution goes awry and he suffers. They learn that someone tampered with the machine. And the other one is found dead, killed in a gruesome manner. Rice suspects Shelton, so he has him picked up. At first, Shelton agrees to a plea agreement with Rice but changes his mind. It appears that Shelton is not done, it appears he blames the whole system and is declaring war on it going after everyone involved with his family's case. So Rice has to stop him but Shelton is way ahead of him."
Gamer,2009,5.8,123637,27,"['Action', 'Sci-Fi', 'Thriller']",50000000.0,42000000.0,"Ken Castle is extremely rich, popular and powerful since he invented and started exploiting the virtual online parallel reality games, in which people can either pay as user or be paid as 'actor' in a system of mind-control. The ultimate version, Slayers, fields death row convicts as gladiators in a desperate dim bid for survival, which no-one made yet. The champion, John 'Kable' Tillman, was scheduled to die just before he'ld gain release, but he persuades his teenage 'handler' to hand over the reins so he can fully use his talents and experience. Thus Kable escapes to freedom, only to be chased illegally by Castle's men, yet fights back all the way to his HQ and challenges his evil hidden plans."
The Ugly Truth,2009,6.5,187037,28,"['Comedy', 'Romance']",38000000.0,205298907.0,"A romantically challenged morning show producer is reluctantly embroiled in a series of outrageous tests by her chauvinistic correspondent to prove his theories on relationships and help her find love. His clever ploys, however, lead to an unexpected result."
RocknRolla,2008,7.3,217192,53,"['Action', 'Crime', 'Thriller']",18000000.0,25739015.0,"Lenny Cole, a London mob boss, puts the bite on all local real estate transactions. For substantial fees, he's helping Uri Omovich, a Russian developer. As a sign of good faith, Omovich loans Cole a valuable painting, promptly stolen off Cole's wall. While Cole's men, led by the dependable Archie, look for the canvas, three local petty criminals, the Wild Bunch, steal money from the Russian using inside information from his accountant, the lovely Stella. Meanwhile, a local drug-addled rocker, Johnny Quid, is reported drowned, and his connection to Cole is the key to unraveling the deceits and double crosses of life in the underworld."
Nim's Island,2008,6.0,31080,55,"['Adventure', 'Comedy', 'Family', 'Fantasy']",37000000.0,100100000.0,"Nim Rusoe is a girl who joins her father, a scientist, when he does research on marine life on an island. It's just the two of them but she spends her time making friends with all the animals she encounters, chatting on the computer and reading the adventure books of Alex Rover. When her father goes to do some research but when a storm strikes the island he doesn't come back, she gets worried and frightened. She then e-mails Alex Rover hoping that he will come but what she doesn't know is that Alex Rover is a woman who is agoraphobic and germaphobic. But her creation comes to life and eggs her to go. Unfortunately she has never gone anywhere before and is denied her necessities like her sanitary gel by the customs officer at the airport. In the meantime, Nim tries to be strong while waiting for Alex to arrive."
Shattered,2007,6.7,28404,Nan,"['Crime', 'Drama', 'Mystery', 'Thriller']",20000000.0,,"The happily-married couple of Neil and Abby Randall have worked very hard to create a healthy and safe bubble for themselves and their only daughter, Sophie. However, their seemingly idyllic life will start crumbling into pieces when, out of the blue, the determined and methodical gunman, Tom Ryan, holds them captive, as his cold-blooded accomplice uses Sophie for leverage. Now, Abby and Neil have no other choice but to do Tom's bidding if they want to keep their child alive--and with every task they successfully perform--they see a piece of their orderly life being robbed from them. But, why is this perfect stranger bent on destroying three innocents?"
300,2006,7.7,682400,52,"['Action', 'Fantasy']",65000000.0,456100000.0,"In the Battle of Thermopylae of 480 BC an alliance of Greek city-states fought the invading Persian army in the mountain pass of Thermopylae. Vastly outnumbered, the Greeks held back the enemy in one of the most famous last stands of history. Persian King Xerxes led a Army of well over 100,000 (Persian king Xerxes before war has about 170,000 army) men to Greece and was confronted by 300 Spartans, 700 Thespians, and 400 Thebans. Xerxes waited for 10 days for King Leonidas to surrender or withdraw but left with no options he pushed forward. After 3 days of battle all the Greeks were killed. The Spartan defeat was not the one expected, as a local shepherd, named Ephialtes, defected to the Persians and informed Xerxes that the separate path through Thermopylae, which the Persians could use to outflank the Greeks, was not as heavily guarded as they thought."
Beowulf & Grendel,2005,5.9,16693,53,"['Action', 'Adventure', 'Drama', 'Fantasy']",,,"The blood-soaked tale of a Norse warrior's battle against the great and murderous troll, Grendel. Heads will roll. Out of allegiance to the King Hrothgar, the much respected Lord of the Danes, Beowulf leads a troop of warriors across the sea to rid a village of the marauding monster. The monster, Grendel, is not a creature of mythic powers, but one of flesh and blood - immense flesh and raging blood, driven by a vengeance from being wronged, while Beowulf, a victorious soldier in his own right, has become increasingly troubled by the hero-myth rising up around his exploits. Beowulf's willingness to kill on behalf of Hrothgar wavers when it becomes clear that the King is more responsible for the troll's rampages than was first apparent. As a soldier, Beowulf is unaccustomed to hesitating. His relationship with the mesmerizing witch, Selma, creates deeper confusion. Swinging his sword at a great, stinking beast is no longer such a simple act. The story is set in barbarous Northern Daneland (Denmark)."
The Game of Their Lives,2005,6.2,2928,47,"['Drama', 'History', 'Sport']",13000000.0,388998.0,Nan
The Phantom of the Opera,2004,7.3,108469,40,"['Drama', 'Musical', 'Romance', 'Thriller']",70000000.0,154600000.0,"Begins when an opera ghost terrorizes the cast and crew of the French Opera House while tutoring a chorus girl. He finally drives the lead soprano crazy so she and her friend leave. The girl is able to sing lead one night but the soprano doesn't want her show stolen so she comes back. The ghost demands they keep giving his protégé lead roles. Meanwhile, His pupil falls in love with the Vicomte de Chagny, but the Phantom is in love with Christine, his student. The Phantom is outraged by their love and kidnaps Christine to be his eternal bride. Will Raoul, the Vicomte, be able to stop this dastardly plan?"
Dear Frankie,2004,7.8,20231,63,"['Drama', 'Romance']",,2980136.0,"Nine-year-old Frankie and his single mum Lizzie have been on the move ever since Frankie can remember, most recently arriving in a seaside Scottish town. Wanting to protect her deaf son from the truth that they've run away from his father, Lizzie has invented a story that he is away at sea on the HMS Accra. Every few weeks, Lizzie writes Frankie a make-believe letter from his father, telling of his adventures in exotic lands. As Frankie tracks the ship's progress around the globe, he discovers that it is due to dock in his hometown. With the real HMS Accra arriving in only a fortnight, Lizzie must choose between telling Frankie the truth or finding the perfect stranger to play Frankie's father for just one day..."
Timeline,2003,5.6,56922,28,"['Action', 'Adventure', 'Sci-Fi']",80000000.0,43900000.0,"A group of archaeologists and combat experts led by Paul Walker and Frances O'Connor use a ""3-D fax machine"" (so much for technobabble!) to time-travel back to France in 1357, in hopes of retrieving Walker's father and returning safely to the present. No such luck. Fending for themselves against marauding hordes of medieval French warriors at war with the invading British, these semi-intrepid travelers find their body count rising, and the deadline for their return home is rapidly approaching."
Reign of Fire,2002,6.2,118275,39,"['Action', 'Adventure', 'Fantasy', 'Sci-Fi', 'Thriller']",60000000.0,82200000.0,"In present-day London, 12-year-old Quinn Abercromby witnesses the awakening of a hibernating dragon from a centuries-long slumber, the result of a construction dig supervised by his mother and an incident for which Quinn feels partially responsible. Twenty years later, the adult Quinn (Christian Bale) is the fire chief of a refortified castle community, responsible for dousing the blazes lit by the dragon's prodigious number of flame-spewing offspring, airborne juggernauts that have wreaked havoc across the globe, torching civilization and turning humans into an endangered species. Hope arrives in the form of Denton ""Dragon Slayer"" Van Zan (Matthew McConaughey), an American known to be the only man to ever kill one of the dragons, and Alex (Izabella Scorupco), a scientist/pilot who's a member of Van Zan's army, a zealous fighting force that includes a secret weapon: the Archangels, paratroopers using themselves as bait to attract and then dispatch the deadly beasts."
Shooters,2002,5.7,1062,Nan,"['Crime', 'Drama', 'Thriller']",,,Nan
Jewel of the Sahara,2001,7.1,197,Nan,"['Comedy', 'Short', 'Fantasy']",,,Nan
Attila,2001,6.7,9489,Nan,"['Action', 'Adventure', 'Biography', 'Drama', 'History', 'Romance', 'War']",,,"A romanced story of Attila the Hun, from when he lost his parents in childhood until his death. Attila is disclosed as a great leader, strategist and lover and the movie shows his respect to the great Roman strategist Flavius Aetius, his loves and passions, the gossips, intrigues and betrayals in Rome, all of these feelings evolved by magic and mysticism."
Dracula 2000,2000,4.9,30014,26,"['Action', 'Fantasy', 'Horror', 'Thriller']",54000000.0,47100000.0,"In the millenium version of this classic Gothic horror we find Abraham Van Helsing (Plummer), who has tangled with Count Dracula (Butler) in the past, working as an English antiques dealer. Simon (Miller) is a vampire hunter in training under his apprenticeship. Van Helsing and Simon travel from London to New Orleans to rescue Van Helsing's daughter Mary (Waddell) from the family's life long nemesis - Dracula."
One More Kiss,1999,6.4,614,Nan,"['Drama', 'Romance']",,,"When Sarah Hopson realizes her successful high-rise New York lifestyle is devoid of meaning, she packs her bags and heads for her home town in the Scottish Borders to look for Sam, her childhood sweetheart and the only man she ever loved. Sam Murray runs a restaurant. He and Sarah grew up together and Sam hoped they'd grow old together. His world fell apart the day Sarah left and now she's back, standing on his doorstep and telling his wife she'd like to spend some time with him."
Fast Food,1999,5.2,201,Nan,"['Action', 'Comedy']",,,Nan
