title,year,rating,votes,metascore,genres,budget,gross,plot outline
Gotti,2018,4.8,8372,24,"['Biography', 'Crime', 'Drama']",10000000.0,4300000.0,"The film will reveal the relationship of a father who lived and died by the mob code and a son who, while brought up to lead a life of crime, chose to leave that world behind and redeem himself and the Gotti name. Never before has there been such an inside look at the Gotti family and their world of danger, betrayal and redemption. John Gotti was head of the Gambino crime family, which in its time was the largest and most powerful crime organization in the country. Known as the ""Dapper Don,"" John Gotti's flamboyant style and outspoken personality made him one of the most famous mobsters of the 20th century and he ruled the underworld until he died from cancer in 2002 while serving a life sentence. In 1988, at the age of 24, Gotti Jr. became a ""made man,"" and was officially inducted into the Mafia, making him the heir-apparent to head the Gambino crime family and follow in his father's footsteps. But in 1999, Gotti Jr. paid a now-famous last visit to his imprisoned and dying father to tell him he was ending his life of crime and getting out of the family business. During the years that followed his father's death, Gotti Jr. had a long legal battle ahead of him and served three jail sentences, totaling approximately nine years, for a variety of charges. Gotti Jr. was finally released from prison in December 2009."
I Am Wrath,2016,5.4,10838,Nan,"['Action', 'Crime', 'Drama', 'Thriller']",18000000.0,,Nan
In a Valley of Violence,2016,6.0,12635,64,"['Action', 'Crime', 'Drama', 'Thriller', 'Western']",,61797.0,Nan
Criminal Activities,2015,5.8,7618,51,"['Crime', 'Drama', 'Thriller']",,,"Pic is about four young guys who reunite at an ex-classmate's funeral. One mentions to the others inside information on a stock that is a guaranteed lock to make them instant millionaires. Unfortunately, the deal goes south along with their investment. Things go from bad to worse: one of them borrowed his share of the money from a mobster."
Life on the Line,2015,5.2,3620,24,"['Action', 'Drama']",,,"LIFE ON THE LINE is a riveting action thriller and family drama centered on Beau (John Travolta), his beloved niece Bailey (Kate Bosworth) and the hardworking men who risk their lives to work ""on the line"" and keep the electric grid running. These unsung heroes brave raging storms and dangerously dizzying heights in their dedication to keeping the populace safe. Toiling hundreds of feet in the air on wires carrying as much as 500,000 volts of electricity, tragedy is often inches away. Haunted by the electrocution death of his brother, Beau is devoted to Bailey and determined to see her go off to college and away from the life of linemen. Bailey has other plans, which include the strapping second-generation lineman Duncan (Devon Sawa), whom Beau despises. A deadly tempest is brewing and headed straight to their Texas town. Beau, Duncan and a legion of linemen are thrust into the eye of the storm and must face down impending disaster to keep their community connected. This compelling action drama also stars Sharon Stone, Ryan Robbins, Julie Benz and Gil Bellows."
The Forger,2014,5.8,10816,32,"['Crime', 'Drama', 'Thriller']",11000000.0,16000000.0,"The world's best art forger (John Travolta) makes a deal with a crime syndicate to get an early release from prison, but in return he must pull off an impossible heist - he must forge a painting by Claude Monet, steal the original from a museum, and replace it with a replica so perfect that no one will notice. He enlists the help of his father (Christopher Plummer) and son (Tye Sheridan) and together they plan the heist of their lives!"
Killing Season,2013,5.4,33003,25,"['Action', 'Drama', 'Thriller']",,39881.0,"Killing Season tells the story of two veterans of the Bosnian War, one American, one Serbian, who clash in the Appalachian Mountain wilderness. FORD is a former American soldier who fought on the front lines in Bosnia. When our story begins, he has retreated to a remote cabin in the woods, trying to escape painful memories of war. The drama begins when KOVAC, a former Serbian soldier, seeks Ford out, hoping to settle an old score. What follows is a cat-and-mouse game in which Ford and Kovac fight their own personal World War III, with battles both physical and psychological. By the end of the film, old wounds are opened, suppressed memories are drawn to the surface and long-hidden secrets about both Ford and Kovac are revealed."
Savages,2012,6.5,114348,59,"['Crime', 'Drama', 'Thriller']",45000000.0,83000000.0,"In California, the former Navy SEAL Chon and his best friend, the peaceful botanist Ben, are successful entrepreneurs producing and dealing high-quality weed. Chon brought seeds from Afghanistan and Ben used his knowledge to develop the best marijuana in the country. Chon and Ben share the pothead lover Ophelia and she loves both of them since they complete each other - Chon is a powerful and strong lover and Ben is a sensible and loving lover. Their comfortable life changes when the Mexican Baja Cartel demands a partnership in their business. Chon and Ben refuse the deal and the leader of the cartel Elena sends her right-arm in America, Lado, to abduct Ophelia to press the American drug dealers. Chon and Ben ask the support of the dirty DEA Agent Dennis and get inside information to begin a secret war against the Baja Cartel to release Ophelia."
From Paris with Love,2010,6.5,106127,42,"['Action', 'Crime', 'Thriller']",52000000.0,52826594.0,"James Reece is an ambitious aide to the U.S. Ambassador in Paris, doing little jobs for the CIA and hoping to get into black ops. On the night he and his girlfriend, Caroline, become engaged, he's told to pick up Charlie Wax at Orly. Charlie is an unorthodox government employee - large, bald and bearded, foul-mouthed and eccentric. Charlie immediately takes James on a wild ride of murder and mayhem, through ethnic enclaves. As bodies pile up, the purpose remains opaque to James. Caroline, unhappy that James has been out of touch for a day, tells him to bring Charlie for dinner. Charlie can be charming - where will it lead? Does the chess-playing James have what it takes?"
Old Dogs,2009,5.4,34184,19,"['Comedy', 'Family']",35000000.0,96800000.0,"Charlie and Dan have been best friends and business partners for thirty years and their Manhattan public relations firm is on the verge of a huge business deal with a Japanese company. With two weeks to sew up the contract, Dan gets a surprise; a woman he married on a drunken impulse nearly nine years before (annulled the next day) shows up to tell him he's the father of her twins, now seven, and she'll be in jail for 14 days for a political protest. Dan volunteers to keep the tykes, although he's uptight and clueless. With Charlie's help is there any way they can be dad and uncle, meet the kids' expectations, and still land the account?"
The Taking of Pelham 123,2009,6.4,170530,55,"['Action', 'Crime', 'Thriller']",100000000.0,150000000.0,"In early afternoon, four armed men hijack a subway train in Manhattan. They stop on a slight incline, decoupling the first car to let the rest of the train coast back. Their leader is Ryder; he connects by phone with Walter Garber, the dispatcher watching that line. Garber is a supervisor temporarily demoted while being investigated for bribery. Ryder demands $10 million within an hour, or he'll start shooting hostages. He'll deal only with Garber. The mayor okays the payoff, the news of the hostage situation sends the stock market tumbling, and it's unclear what Ryder really wants or if Garber is part of the deal. Will hostages, kidnappers, and negotiators live through this?"
Bolt,2008,6.9,171016,67,"['Animation', 'Adventure', 'Comedy', 'Drama', 'Family']",150000000.0,310000000.0,"Bolt, an American white shepherd, has lived his whole life on the set of his action TV show, where he believes he has superpowers. When separated from the studio by accident, he meets a female alley cat named Mittens and a hamster named Rhino. He's trying to find the way home, to the studio. Along the way, he learns that he doesn't have superpowers and that the show is not real."
Hairspray,2007,6.7,110996,81,"['Comedy', 'Drama', 'Musical', 'Romance']",75000000.0,202500000.0,"Tracy Turnblad, a teenager with all the right moves, is obsessed with the Corny Collins Show. Every day after school, she and her best friend Penny run home to watch the show and drool over the hot Link Larkin, much to Tracy's mother Edna's dismay. After one of the stars of the show leaves, Corny Collins holds auditions to see who will be the next teen regular. With the help of her friend Seaweed, Tracy is chosen, angering evil dance queen Amber Von Tussle and her mother Velma. Tracy then decides that it's not fair that black kids can only dance on the show once a month (on ""Negro Day""), and with the help of Seaweed, Link, Penny, Motormouth Maybelle, her father, and Edna, she's going to integrate the show.....without denting her 'do."
Wild Hogs,2007,5.9,108252,27,"['Adventure', 'Comedy']",60000000.0,253600000.0,"Four middle-aged men decide to take a road trip from Cincinnati to the Pacific in order to get away from their lives which are leading them nowhere. Taking their motorcycles, these ""Wild Hogs"" tear up the road and eventually stop in New Mexico for a drink not knowing that the bar belongs to the ""Del Fuegos"", a mean biker gang. When the Del Fuegos steal a bike that belongs to the Wild Hogs, the four men form a plan to steal their bike back."
Lonely Hearts,2006,6.5,19267,60,"['Crime', 'Drama', 'Romance', 'Thriller']",,2519154.0,"In the late 1940's, Martha Beck and Raymond Fernandez were America's notorious ""Lonely Hearts Killers"". Their lethal scam was simple; they would swindle and then viciously murder lovelorn war widows who would answer their personal ads in which Ray would describe himself as a sexy Latin Lover. Ironically, Ray's initial introduction to Martha was as a prospective mark. But when they met, it was love at first sight, perhaps as a result of their penchant for kinky sex and their mutual love for duplicity and easy money. With Martha posing as Ray's sister, they bilked elderly spinsters and widows of their savings and then viciously murdered them in a bloodbath of sexual frenzy. When they were arrested, Martha and Ray confessed to 12 killings, although it is believed the actual number is closer to 20. At their sensational trial, Martha and Ray cooed, held hands and seemed as though they could not get enough of each other. Their plea of not guilty by reason of insanity was rejected, and on August 22, 1949, the homicidal lovers were sentenced to death. After numerous appeals, they were electrocuted on March 8, 1951, side-by-side in Sing Sing prison."
Be Cool,2005,5.7,64147,37,"['Comedy', 'Crime', 'Music']",53000000.0,95200000.0,"Streetwise mobster-turned-movie producer Chili Palmer is back, but this time Chili has abandoned the fickle movie industry and veered into the music business, tangling with Russian mobsters and gangsta rappers and taking a talented, feisty young singer named Linda Moon under his wing. From the recording studio to an Aerosmith concert to the MTV Music Awards, he manipulates events to watch them play out the Chili way, using his signature blend of wiseguy skills and negotiation tactics. It's a dangerous business, and everyone's looking for their next big hit."
Ladder 49,2004,6.5,52105,47,"['Action', 'Drama', 'Thriller']",60000000.0,102300000.0,"Under the watchful eye of his mentor Captain Mike Kennedy, probationary firefighter Jack Morrison matures into a seasoned veteran at a Baltimore fire station. Jack has reached a crossroads, however, as the sacrifices he's made have put him in harm's way innumerable times and significantly impacted his relationship with his wife and kids. Responding to the worst blaze in his career, he becomes trapped inside a 20-story building. And as he reflects on his life, now Deputy Chief Kennedy frantically coordinates the effort to save him."
A Love Song for Bobby Long,2004,7.2,23776,48,['Drama'],,1841260.0,"A young woman, Pursy (played by Scarlett Johansson), learns that her estranged mother has died in New Orleans. She returns to her mother's house to discover that it is inhabited by two men, one an aging alcoholic, Bobby Long (John Travolta)."
The Punisher,2004,6.5,140573,33,"['Action', 'Adventure', 'Crime', 'Drama', 'Thriller']",33000000.0,54700000.0,"Special agent Frank Castle had it all: A loving family, a great life, and an adventurous job. But when his life is taken away from him by a ruthless criminal and his associates, Frank has become reborn. Now serving as judge, jury, and executioner, he's a new kind of vigilante out to wage a one man war against those who have done him wrong."
Basic,2003,6.5,55375,34,"['Action', 'Crime', 'Drama', 'Mystery', 'Thriller']",50000000.0,42800000.0,"Tom Hardy, an ex-Army Ranger turned DEA agent, is drawn into an ever-widening mystery surrounding the disappearance of the feared and often hated Sgt. Nathan West, as well as several of his elite Special Forces trainees on what appears, at first, to have been a routine training exercise during a hurricane in the jungles of Panama. Only two survivors are found, Dunbar, and a badly wounded Kendall, the son of a high-profile Joint Chiefs of Staff official. Neither is willing to cooperate with Capt. Julia Osborne's investigation. So base commander Col. Bill Styles calls in ex-Ranger Hardy, an old friend and a persuasive interrogator. Osborne disapproves of Hardy who is on leave from the D.E.A. after having come under suspicion of accepting bribes from local drug traffickers. She is also uneasy when she learns that Hardy once trained under West and hates him almost as passionately as his current recruits. With time running out, Hardy and Osborne call a temporary, if uneasy, truce. Hardy cajoles a confession out of Dunbar, who claims that Sgt. West and the missing Rangers have been murdered and their bodies blown away by the hurricane. When they later interview Kendall, he confirms that the other Rangers and West are dead. But, in almost every other way, his story contradicts Dunbar's. What happened to West and his Ranger team? And what were they really doing out there in the jungle? As each layer reveals more lies and greater deceptions, Hardy and Osborne inch towards the horrible truth about the fate of the missing Rangers."
Domestic Disturbance,2001,5.6,23063,29,"['Crime', 'Mystery', 'Thriller']",75000000.0,54200000.0,"Susan Morrison is getting married to wealthy industrialist Rick Barnes. Danny, her teenage son with ex-husband Frank, isn't happy about this; he stows away in Rick's car one night, planning to go to Frank's house. But while there, he witnesses Rick murdering mysterious stranger Ray Coleman. Problem is, Rick's managed to dispose of most of the evidence, and he's considered a pillar of the community, while Danny has a history of lying. Frank believes him, though, and does some investigating of his own, as Rick's shady past slowly catches up to him and his new family."
Swordfish,2001,6.5,167590,32,"['Action', 'Crime', 'Thriller']",102000000.0,147100000.0,"When the DEA shut down its dummy corporation operation codenamed SWORDFISH in 1986, they had generated $400 million which they let sit around; fifteen years of compound interest has swelled it to $9.5 billion. A covert counter-terrorist unit called Black Cell, headed by the duplicitious and suave Gabriel Shear, wants the money to help finance their raise-the-stakes vengeance war against international terrorism, but it's all locked away behind super-encryption. He brings in convicted hacker Stanley Jobson, who only wants to see his daughter Holly again but can't afford the legal fees, to slice into the government mainframes and get the money."
Lucky Numbers,2000,5.0,9317,31,"['Comedy', 'Crime']",63000000.0,10890222.0,"Winter 1988. Harrisburg, Pennsylvania is Russ Richard's oyster, there where he is the popular weatherman for WTPA Channel 6 News. That popularity allows him many perks in the city, especially at his local Denny's. Things start to go off the rails for him as this winter is unseasonably warm and not white, meaning that no one is buying from his snowmobile dealership, and none of his usual sources are willing to advance him any money to tide him over this rough business patch. In turning to Gig, a slightly shady acquaintance who operates a strip club and bar, Russ decides to turn to illegal activities to get the money he needs. After one failed attempt at that criminal life which has its own negative consequences, Russ instead decides on a lottery scam, his partners in crime being Gig, and Crystal Latroy, Russ' colleague at WTPA as the Pennsylvania Lucky Six Lottery girl - the lottery numbers which are drawn live on air during WTPA's supper hour news - and his sometime lover. Crystal is also sleeping with her and Russ' married boss, WTPA manager Dick Simmons, in an effort to get ahead in the world. Russ, Gig and Crystal are able to devise a plan to win the next jackpot, worth $6.4 million. As they enact the plan, which requires the assistance from a few others, the plan also potentially starts to go off the rails as those in the know and those who think that they know something about the fraud want what they believe is their fair share which, if Russ would agree, would get him further in the hole than he was before going into the venture. But as things get more and more dangerous and potentially lethal, Russ, Crystal and Gig begin to have diverging views on how to get out from the increasing mess based on their own tolerance of the risk for the potential reward."
Battlefield Earth,2000,2.5,71844,9,"['Action', 'Adventure', 'Sci-Fi']",43000000.0,29700000.0,"In the year 3000, humanity is no match for the Psychlos, a greedy, manipulative race on a quest for ultimate profit. Led by the seductive and powerful Terl, the Psychlos are stripping Earth of its resources, using the broken remnants of humanity as slaves. What is left of the human race has reverted to a primitive state, believing the invaders to be demons and technology to be evil. After humanity has all but given up any hope of freeing themselves from alien oppression, a young man named Tyler decides to leave his desolate home high in the Rocky Mountains to discover the truth, whereupon he is captured and enslaved. It is then that he decides to fight back, leading his fellow man in one final struggle for freedom."
The General's Daughter,1999,6.3,48260,47,"['Crime', 'Drama', 'Mystery', 'Thriller']",95000000.0,149000000.0,"The naked corpse of Captain Elisabeth Campbell, daughter of Lieutenant General ""Fighting Joe"" Campbell, is found staked out on the urban warfare range of Fort MacCallum. Army CID detectives and ex-lovers Paul Brenner and Sara Sunhill are called in to investigate, and find themselves wrapped up in a maelstrom of sexual impropriety and misguided face-saving."
A Civil Action,1998,6.6,25528,68,['Drama'],75000000.0,56000000.0,"Jan Schlichtmann, a tenacious lawyer, is addressed by a group of families. When investigating the seemingly non-profiting case, he finds it to be a major environmental issue that has a lot of impact potential. A leather production company could be responsible for several deadly cases of leukemia, but also is the main employer for the area. Schlichtmann and his three colleagues set out to have the company forced to decontaminate the affected areas, and of course to sue for a major sum of compensation. But the lawyers of the leather company's mother company are not easy to get to, and soon Schlichtmann and his friends find themselves in a battle of mere survival."
The Thin Red Line,1998,7.6,158360,78,"['Drama', 'War']",52000000.0,98100000.0,"U.S. Army Private Witt (AWOL) is found and imprisoned on a troop carrier by his company First Sergeant, Welsh.The men of C Company,1st Battalion,27th Infantry Regiment,25th Infantry Division have been brought to Guadalcanal as reinforcements in the campaign to secure Henderson Field and seize the island from the Japanese. They arrive near Hill 210, a key Japanese position. Their task is to capture the hill at all cost. What happens next is a story developing about redemption and the meaningless of war. Regardless the outcome."
Welcome to Hollywood,1998,5.3,648,Nan,['Comedy'],,,"A film director (Adam Rifkin) decides to chart the course of a young actor (Tony Markes) as he tries to make it in Hollywood. Attempts to get him noticed and placed in roles meet with failure. A guest role on ""Baywatch"" ends when he steps on a stingray and has to be hospitalized. The filmmaker's frustration is multiplied by the fact that the original actor (David Andriole) he had selected and who had to drop out of the project because of a studio commitment, meets success and constantly crops up in roles where the second actor is struggling for his break."
Primary Colors,1998,6.7,25827,70,"['Comedy', 'Drama']",65000000.0,52100000.0,Jack Stanton is running for president. The election is seen through the eyes of young Henry Burton. Along the way Stanton must deal with a sex scandal.
Mad City,1997,6.2,17982,45,"['Crime', 'Drama', 'Thriller']",50000000.0,10500000.0,"Sam Baily, upset over losing his job, takes a natural history museum hostage. Max Brackett, journalist, is in the museum when this occurs, and gets the scoop. The story spreads nation wide, and soon it is all anyone talks about. The story itself is the news, not the reason why or the real people behind it."
Face/Off,1997,7.3,320947,82,"['Action', 'Crime', 'Sci-Fi', 'Thriller']",80000000.0,245700000.0,"Sean Archer, a very tough, rugged FBI Agent, is still grieving for his dead son Michael. Archer believes that his son's killer is his sworn enemy and a very powerful criminal, Castor Troy. One day, Archer has finally cornered Castor, however, their fight has knocked out Troy cold. As Archer finally breathes easy over the capture of his enemy, he finds out that Troy has planted a bomb that will destroy the entire city of Los Angeles and all of its inhabitants. Unfortunately the only other person who knows its location is Castor's brother Pollux, and he refuses to talk. The solution, a special operation doctor that can cut off people's faces, and can place a person's face onto another person. Archer undergoes one of those surgeries to talk to Pollux. However, Castor Troy somehow regains consciousness and now wants revenge on Archer for taking his face. Not only is Troy ruining Archer's mission, but his personal life as well. Archer must stop Troy again. This time, it's personal."
She's So Lovely,1997,5.9,7598,Nan,"['Drama', 'Romance']",18000000.0,7281450.0,"Maureen is pregnant and her husband Eddie is missing. Nervous, Maureen shares a couple of drinks with neighbor Kiefer, who tries to rape her and then beats her. When Eddie returns and finds his wife bruised, he goes ballistic, shoots a paramedic and is put in a psychiatric institution. Ten years later, Eddie is released and finds that Maureen has divorced him and is remarried with three children, one of whom is his little girl Jeanie. Eddie goes to reclaim his wife."
Michael,1996,5.7,38123,38,"['Comedy', 'Drama', 'Fantasy']",,119700000.0,"Frank Quinlan and Huey Driscoll, two reporters from a Chicago-based tabloid, along with Dorothy Winters, an 'angel expert', are asked to travel to rural Iowa to investigate a claim from an old woman that she shares her house with a real, live archangel named Michael. Upon arrival, they see that her claims are true - but Michael is not what they expected: he smokes, drinks beer, has a very active libido and has a rather colourful vocabulary. In fact, they would never believe it were it not for the two feathery wings protruding from his back. Michael agrees to travel to Chicago with the threesome, but what they don't realise is that the journey they are about to undertake will change their lives forever."
Phenomenon,1996,6.4,70134,41,"['Drama', 'Fantasy', 'Romance', 'Sci-Fi']",32000000.0,152036382.0,"John Travolta plays George Malley, who owns the local auto repair shop in a small California town. After celebrating his birthday with friends at the local bar/hang-out, George heads for home. He pauses to watch a strange light in the sky, then collapses for a few seconds in the middle of the deserted street. In the days and weeks that follow, George finds his IQ and consciousness expanding dramatically, and develops telekinetic abilities. Despite his attempts to explain what has happened to him, with just a very few exceptions, most of the local townspeople treat the ""new"" George as a freak. His state of isolation becomes even more pronounced when his new-found abilities allow him to correctly predict an earthquake, and outside authorities become interested in what's happened to him."
Broken Arrow,1996,6.0,84843,61,"['Action', 'Adventure', 'Thriller']",50000000.0,150200000.0,"""Broken Arrow"" is the term used to describe a nuclear device that has been lost. In this movie, two nuclear missiles are stolen by rogue US pilot Deakins, but hot on his trail is his co-pilot Hale and a Park Ranger, Terry. The action takes place in Utah's canyon country; a high stakes game of cat and mouse."
Get Shorty,1995,6.9,70103,82,"['Comedy', 'Crime', 'Thriller']",30000000.0,115000000.0,"Some guys get all the luck, whether they like it or not. Chili Palmer happens to be in Hollywood collecting a gambling debt when he's struck by lightning (not literally). Called a natural for the movie business, he's snagged up by a producer. The rest is history."
