title,year,rating,votes,metascore,genres,budget,gross,plot outline
Look Who's Talking Now,1993,4.3,25411,Nan,"['Comedy', 'Family', 'Romance']",22000000.0,10340263.0,"In this, the third film, it's the pets who do the talking. The Ubriacco's find themselves the owners of two dogs, Rocks, a street wise cross breed, and Daphne, a spoiled pedigree poodle. James has a new job, pilot to the sexy and lonely Samantha. Mollie's just lost hers and is stuck at home."
Boris and Natasha,1992,4.6,686,Nan,"['Action', 'Comedy']",1000000.0,294205.0,"Boris Badenov and Natasha Fatale are still spies for the mean little country of Pottsylvania, where, sandwiched between the nations Wrestlemania and Yoursovania, the Cold War is still frigid. Their Fearless Leader hatches a plan to capture a time-reverse micro-chip, using the two spies as high-profile patsies. They clumsily defect to America and try to unravel F.L.'s master plan. But can these dim-witted fools survive a secret assassin, exploding potatoes and the temptations of capitalism? And what of their old foes, ""Moosk unt Squoirrel""?"
Shout,1991,5.1,1692,Nan,"['Drama', 'Music', 'Romance']",11000000.0,3547684.0,Nan
Eyes of an Angel,1991,5.4,1016,Nan,['Drama'],,,"John Travolta is a downtrodden single father raising his daughter under difficult circumstances in Chicago. The young girl comes upon and then nurses a wounded Doberman used for fighting, back to health. Duped by underworld types he was working as a courier for, father and daughter leave the dog and flee cross-country to Los Angeles with both canine and mobsters in pursuit."
Chains of Gold,1991,5.1,789,Nan,"['Action', 'Crime', 'Drama', 'Thriller']",,,"Scott Barnes is an alcoholic turned social worker hellbent on saving a young boy named Tommy from self-destructing when he finds out he has begun selling crack in an organization called YIP, run by Carlos."
Look Who's Talking Too,1990,4.5,41256,Nan,"['Comedy', 'Family', 'Romance']",,47800000.0,"Mollie and James are together and raising a family, which now consists of an older Mikey and his baby sister, Julie. Tension between the siblings arises, and as well with Mollie and James when Mollie's brother Stuart moves in. Mikey is also learning how to use the toilet for the first time."
Look Who's Talking,1989,5.8,71654,51,['Comedy'],7500000.0,297000000.0,"Mollie is a single mum who's on the lookout for a reliable and normal boyfriend. Her son Mikey, (unbeknownst to her) seems to have a better idea of which of the men she dates would make a good father figure! If only she could understand him..."
The Experts,1989,4.7,2115,Nan,['Comedy'],3000000.0,169203.0,Travis and Wendell are kidnapped while on their way to opening a nightclub in rural Nebraska. The KGB spy Cameron Smith takes them to the U.S.S.R. instead with the intention of teaching KGB agents to be hip like Americans.
Perfect,1985,4.3,4068,46,"['Drama', 'Romance']",20000000.0,12918858.0,"Fed up with writing obituaries for a local New Jersey newspaper, the inquisitive and ambitious journalist, Adam Lawrence, finally gets his big break, when--as a Rolling Stone reporter--gets to interview a well-off entrepreneur accused of drug-dealing. However, one brief look at the tight-bodied members of a modern gym will have Adam itching to write an exposé on the latest craze of fitness and health centres, where aerobics instructors like the ferociously-astonishing, Jessie, are the absolute stars. But, Jessie, really despises interviewers. Will she ever let him into her sultry world of cool music, high-energy exercise, and perfection?"
Two of a Kind,1983,4.8,3560,5,"['Comedy', 'Fantasy', 'Romance']",,23646952.0,"God has had just about enough of the human's attitude so he will destroy the planet very soon. It is up to a struggling inventor and a bank teller, both with very amateur criminal minds, to save the world..."
Staying Alive,1983,4.5,13023,23,"['Drama', 'Music', 'Romance']",22000000.0,64800000.0,"In this sequel to Saturday Night Fever, former disco king Tony Manero has left Brooklyn and lives in Manhattan. He stays in a cheap hotel and works as a dance instructor and as a waiter at a dance club, trying to succeed as a professional dancer on Broadway. The breakaway from his Brooklyn life, family and friends seems to have matured Tony and refined his personality, represented by his diminished accent and his avoidance of alcohol and profanity. However, certain attitudes have not changed, as with his most recent girlfriend, who's also the singer of a local rock band."
Blow Out,1981,7.4,36201,85,"['Mystery', 'Thriller']",18000000.0,14000000.0,"This stylish Brian De Palma thriller plays off the theme of the unsuspecting witness who discovers a crime and is thereby put in grave danger, but with a novel twist. Jack Terry is a master audio technician who makes his living by recording unique sounds for grade-B horror movies. Late one evening, he is recording sounds for use in his movies when he hears something unexpected through his sound equipment and records it. Curiosity gets the better of him when the media become involved, and he begins to unravel the pieces of a nefarious conspiracy. As he struggles to survive against his shadowy enemies and expose the truth, he does not know whom he can trust."
Urban Cowboy,1980,6.3,11731,61,"['Drama', 'Romance', 'Western']",10000000.0,53300000.0,"Bud Davis is a country boy who moves to the city to visit his uncle and his family. He starts hanging out at Gilley's, the popular nightclub owned by Mickey Gilley himself. He takes a job at the oil refinery where his uncle works, hoping to save enough money to buy some land. He also meets a cowgirl named Sissy, they dance together, fall in love and suddenly get married. And then their marriage is shattered when Bud sees Sissy allegedly seeing con man Wes, who teaches her how to ride the mechanical bull... and plans to rob Gilley's. When a bull-riding contest at Gilley's is announced, Bud decides to sign up. Can he win the contest and save his marriage to Sissy?"
"Welcome Back, Kotter",1975,7.0,4605,Nan,['Comedy'],,,"Gabe Kotter is a high-school teacher with a bunch of unruly students in his class. The student troublemakers are led by Vinnie Barbarino, who has a knack for rhyming insults."
Moment by Moment,1978,2.9,977,Nan,"['Drama', 'Romance']",8000000.0,10963824.0,"One year after ""Saturday Night Fever,"" John Travolta starred in this love story between a young drifter and an older woman - Lily Tomlin. The characters are savagely portrayed, and the story is set against a backdrop of shrink-riddled and over-privileged society."
Grease,1978,7.2,204623,70,"['Musical', 'Romance']",6000000.0,395000000.0,"A musical about teens in love in the 50's! It's California 1959 and greaser Danny Zuko and Australian Sandy Olsson are in love. They spend time at the beach, and when they go back to school, what neither of them knows is that they both now attend Rydell High. Danny's the leader of the T-Birds, a group of black leather jacket-wearing greasers while Sandy hangs with the Pink Ladies, a group of pink-wearing girls led by Rizzo. When they clash at Rydell's first pep rally, Danny isn't the same Danny from the beach. They try to be like each other so they can be together."
Saturday Night Fever,1977,6.8,63270,77,"['Drama', 'Music']",3500000.0,237100000.0,"Nineteen-year-old Brooklyn native Tony Manero lives for Saturday nights at the local disco, where he's king of the club, thanks to his stylish moves on the dance floor. But outside of the club, things don't look so rosy. At home, Tony fights constantly with his father and has to compete with his family's starry-eyed view of his older brother, a priest. Nor can he find satisfaction at his dead-end job at a small paint store. However, things begin to change when he spies Stephanie Mangano in the disco and starts training with her for the club's dance competition. Stephanie dreams of the world beyond Brooklyn, and her plans to move to Manhattan just over the bridge soon change Tony's life forever."
The Boy in the Plastic Bubble,1976,5.7,4005,Nan,"['Biography', 'Drama', 'Romance']",,,"Based on a true story, Tod Lubitch is born with a deficient immune system (which is unlike being born with AIDS). As such, he must spend the rest of his life in a completely sterile environment. His room is completely hermetically sealed against bacteria and virus, his food is specially prepared, and his only human contact comes in the form of gloved hands. The movie follows his life into a teenager."
Carrie,1976,7.4,148919,85,['Horror'],1800000.0,33800000.0,"It's nearing the end of the school year. High school senior Carrie White is a social outcast, largely due to being unwise to the ways of the world based on her upbringing. Her mother, Margaret White, is a religious fanatic, her extreme views primarily targeted against sex, which she believes is a sin. She even believes natural associated processes such as menstruation are a sin, about which she has refused to mention to Carrie. Mrs. White's beliefs were taken to that extreme largely because of her own failed marriage and her husband Ralph long ago having run off with another woman. The only adult authority figure who tries to help Carrie with her life is her phys ed teacher, Miss Collins, who is nonetheless warned not to get too close to go against how Mrs. White chooses to raise Carrie, Mrs. White whose beliefs are well known in the community. An impromptu event that happens among Carrie's phys ed classmates against her leads to her classmates being punished. One of those students, self absorbed Chris Hargensen, vows revenge against Carrie for that punishment, the method of the revenge associated to the phys ed class incident. Another student however, the popular Sue Snell, begins to feel sorry for Carrie. In wanting to help her get out of her shell, Sue asks her boyfriend, the equally popular Tommy Ross, to take Carrie to the senior prom instead of her. This move does not sit well with Mrs. White, who in her extreme view believes Carrie will fall prey to sin. All these competing issues lead to Carrie deciding on an impulse to use a newfound skill to free herself from the figurative chains that have long been placed around her, with tragic consequences."
The Tenth Level,1976,6.6,177,Nan,['Drama'],300000.0,,"Inspired by the Stanley Milgram obedience research, this TV movie chronicles a psychology professor's study to determine why people, such as the Nazis, were willing to ""just follow orders"" and do horrible things to others. Professor Stephen Turner leads students to believe that they are applying increasingly painful electric shocks to other subjects when they fail to perform a task correctly, and is alarmed to see how much pain the students can be convinced to inflict ""in the name of science."""
